<?xml version="1.0" encoding="UTF-8"?>
<xs:schema xmlns:xs="http://www.w3.org/2001/XMLSchema">
    <xs:element name="bank_transactions">
        <xs:complexType>
            <xs:sequence>
                <xs:element name="transaction" maxOccurs="unbounded">
                    <xs:complexType>
                        <xs:sequence>

                            <xs:element name="date" type="xs:date"/>

                            <xs:element name="source_account">
                                <xs:complexType>
                                    <xs:sequence>
                                        <xs:element name="bank" type="xs:string"/>
                                        <xs:element name="account_number">
                                            <xs:simpleType>
                                                <xs:restriction base="xs:int">
                                                    <xs:minInclusive value="1"/>
                                                </xs:restriction>
                                            </xs:simpleType>
                                        </xs:element>
                                    </xs:sequence>
                                </xs:complexType>
                            </xs:element>


                            <xs:element name="destination_account">
                                <xs:complexType>
                                    <xs:sequence>
                                        <xs:element name="bank" type="xs:string"/>
                                        <xs:element name="account_number">
                                            <xs:simpleType>
                                                <xs:restriction base="xs:int">
                                                    <xs:minInclusive value="1"/>
                                                </xs:restriction>
                                            </xs:simpleType>
                                        </xs:element>
                                    </xs:sequence>
                                </xs:complexType>
                            </xs:element>

                            <xs:element name="amount">
                                <xs:complexType>
                                    <xs:simpleContent>

                                        <xs:extension base="xs:decimal">
                                            <xs:attribute name="currency" type="xs:string" use="required"/>
                                        </xs:extension>

                                    </xs:simpleContent>
                                </xs:complexType>
                            </xs:element>

                            <xs:element name="description" type="xs:string"/>

                        </xs:sequence>

                        <xs:attribute name="id" use="required">
                            <xs:simpleType>
                                <xs:restriction base="xs:int">
                                    <xs:minInclusive value="1"/>
                                </xs:restriction>
                            </xs:simpleType>
                        </xs:attribute>

                    </xs:complexType>
                </xs:element>
            </xs:sequence>
        </xs:complexType>
    </xs:element>
</xs:schema>
